### ISSUE TITLE
Cannot connect while connecting...

### ISSUE THREAD

**Issue by LazyPlanet** [hwdsl2/setup-ipsec-vpn#1728]
My client is connecting, while server print log : 

08:43:15.107627 eth0  Out IP iZt4ne8rtc7hgmeasjzdoaZ.ipsec-nat-t > 127.180.185.123.broad.dl.ln.dynamic.163data.com.cn.15120: NONESP-encap: isakmp: parent_sa inf2
08:43:40.711366 eth0  Out IP iZt4ne8rtc7hgmeasjzdoaZ.ipsec-nat-t > 127.180.185.123.broad.dl.ln.dynamic.163data.com.cn.15652: NONESP-encap: isakmp: parent_sa inf2
08:43:46.555383 eth0  Out IP iZt4ne8rtc7hgmeasjzdoaZ.ipsec-nat-t > 127.180.185.123.broad.dl.ln.dynamic.163data.com.cn.15120: NONESP-encap: isakmp: parent_sa inf2
08:44:50.747964 eth0  Out IP iZt4ne8rtc7hgmeasjzdoaZ.ipsec-nat-t > 127.180.185.123.broad.dl.ln.dynamic.163data.com.cn.15120: NONESP-encap: isakmp: parent_sa inf2
08:45:48.726077 eth0  Out IP iZt4ne8rtc7hgmeasjzdoaZ.ipsec-nat-t > 127.180.185.123.broad.dl.ln.dynamic.163data.com.cn.15652: NONESP-encap: isakmp: parent_sa inf2
09:02:05.563121 eth0  In  IP 127.180.185.123.broad.dl.ln.dynamic.163data.com.cn.15426 > iZt4ne8rtc7hgmeasjzdoaZ.isakmp: isakmp: parent_sa ikev2_init[I]
09:02:05.563730 eth0  Out IP iZt4ne8rtc7hgmeasjzdoaZ.isakmp > 127.180.185.123.broad.dl.ln.dynamic.163data.com.cn.15426: isakmp: parent_sa ikev2_init[R]
09:02:05.887123 eth0  In  IP 127.180.185.123.broad.dl.ln.dynamic.163data.com.cn.15426 > iZt4ne8rtc7hgmeasjzdoaZ.isakmp: isakmp: parent_sa ikev2_init[I]
09:02:05.890652 eth0  Out IP iZt4ne8rtc7hgmeasjzdoaZ.isakmp > 127.180.185.123.broad.dl.ln.dynamic.163data.com.cn.15426: isakmp: parent_sa ikev2_init[R]
09:02:06.229400 eth0  In  IP 127.180.185.123.broad.dl.ln.dynamic.163data.com.cn.15428 > iZt4ne8rtc7hgmeasjzdoaZ.ipsec-nat-t: NONESP-encap: isakmp: child_sa  ikev2_auth[I]
09:02:06.229400 eth0  In  IP 127.180.185.123.broad.dl.ln.dynamic.163data.com.cn.15428 > iZt4ne8rtc7hgmeasjzdoaZ.ipsec-nat-t: NONESP-encap: isakmp: child_sa  ikev2_auth[I]
09:02:06.288324 eth0  Out IP iZt4ne8rtc7hgmeasjzdoaZ.ipsec-nat-t > 127.180.185.123.broad.dl.ln.dynamic.163data.com.cn.15428: NONESP-encap: isakmp: child_sa  ikev2_auth[R]
09:02:06.288376 eth0  Out IP iZt4ne8rtc7hgmeasjzdoaZ.ipsec-nat-t > 127.180.185.123.broad.dl.ln.dynamic.163data.com.cn.15428: NONESP-encap: isakmp: child_sa  ikev2_auth[R]
09:02:06.288383 eth0  Out IP iZt4ne8rtc7hgmeasjzdoaZ.ipsec-nat-t > 127.180.185.123.broad.dl.ln.dynamic.163data.com.cn.15428: NONESP-encap: isakmp: child_sa  ikev2_auth[R]
09:02:06.288404 eth0  Out IP iZt4ne8rtc7hgmeasjzdoaZ.ipsec-nat-t > 127.180.185.123.broad.dl.ln.dynamic.163data.com.cn.15428: NONESP-encap: isakmp: child_sa  ikev2_auth[R]
09:02:06.712355 eth0  In  IP 127.180.185.123.broad.dl.ln.dynamic.163data.com.cn.15428 > iZt4ne8rtc7hgmeasjzdoaZ.ipsec-nat-t: NONESP-encap: isakmp: child_sa  ikev2_auth[I]
09:02:06.712517 eth0  In  IP 127.180.185.123.broad.dl.ln.dynamic.163data.com.cn.15428 > iZt4ne8rtc7hgmeasjzdoaZ.ipsec-nat-t: NONESP-encap: isakmp: child_sa  ikev2_auth[I]
09:02:06.712567 eth0  Out IP iZt4ne8rtc7hgmeasjzdoaZ.ipsec-nat-t > 127.180.185.123.broad.dl.ln.dynamic.163data.com.cn.15428: NONESP-encap: isakmp: child_sa  ikev2_auth[R]
09:02:06.712593 eth0  Out IP iZt4ne8rtc7hgmeasjzdoaZ.ipsec-nat-t > 127.180.185.123.broad.dl.ln.dynamic.163data.com.cn.15428: NONESP-encap: isakmp: child_sa  ikev2_auth[R]
09:02:06.712602 eth0  Out IP iZt4ne8rtc7hgmeasjzdoaZ.ipsec-nat-t > 127.180.185.123.broad.dl.ln.dynamic.163data.com.cn.15428: NONESP-encap: isakmp: child_sa  ikev2_auth[R]
09:02:06.712611 eth0  Out IP iZt4ne8rtc7hgmeasjzdoaZ.ipsec-nat-t > 127.180.185.123.broad.dl.ln.dynamic.163data.com.cn.15428: NONESP-encap: isakmp: child_sa  ikev2_auth[R]
09:02:07.737384 eth0  In  IP 127.180.185.123.broad.dl.ln.dynamic.163data.com.cn.15428 > iZt4ne8rtc7hgmeasjzdoaZ.ipsec-nat-t: NONESP-encap: isakmp: child_sa  ikev2_auth[I]
09:02:07.737385 eth0  In  IP 127.180.185.123.broad.dl.ln.dynamic.163data.com.cn.15428 > iZt4ne8rtc7hgmeasjzdoaZ.ipsec-nat-t: NONESP-encap: isakmp: child_sa  ikev2_auth[I]
09:02:07.737583 eth0  Out IP iZt4ne8rtc7hgmeasjzdoaZ.ipsec-nat-t > 127.180.185.123.broad.dl.ln.dynamic.163data.com.cn.15428: NONESP-encap: isakmp: child_sa  ikev2_auth[R]
09:02:07.737620 eth0  Out IP iZt4ne8rtc7hgmeasjzdoaZ.ipsec-nat-t > 127.180.185.123.broad.dl.ln.dynamic.163data.com.cn.15428: NONESP-encap: isakmp: child_sa  ikev2_auth[R]
09:02:07.737628 eth0  Out IP iZt4ne8rtc7hgmeasjzdoaZ.ipsec-nat-t > 127.180.185.123.broad.dl.ln.dynamic.163data.com.cn.15428: NONESP-encap: isakmp: child_sa  ikev2_auth[R]
09:02:07.737641 eth0  Out IP iZt4ne8rtc7hgmeasjzdoaZ.ipsec-nat-t > 127.180.185.123.broad.dl.ln.dynamic.163data.com.cn.15428: NONESP-encap: isakmp: child_sa  ikev2_auth[R]
09:02:09.737354 eth0  In  IP 127.180.185.123.broad.dl.ln.dynamic.163data.com.cn.15428 > iZt4ne8rtc7hgmeasjzdoaZ.ipsec-nat-t: NONESP-encap: isakmp: child_sa  ikev2_auth[I]
09:02:09.737466 eth0  In  IP 127.180.185.123.broad.dl.ln.dynamic.163data.com.cn.15428 > iZt4ne8rtc7hgmeasjzdoaZ.ipsec-nat-t: NONESP-encap: isakmp: child_sa  ikev2_auth[I]
09:02:09.737577 eth0  Out IP iZt4ne8rtc7hgmeasjzdoaZ.ipsec-nat-t > 127.180.185.123.broad.dl.ln.dynamic.163data.com.cn.15428: NONESP-encap: isakmp: child_sa  ikev2_auth[R]
09:02:09.737599 eth0  Out IP iZt4ne8rtc7hgmeasjzdoaZ.ipsec-nat-t > 127.180.185.123.broad.dl.ln.dynamic.163data.com.cn.15428: NONESP-encap: isakmp: child_sa  ikev2_auth[R]
09:02:09.737609 eth0  Out IP iZt4ne8rtc7hgmeasjzdoaZ.ipsec-nat-t > 127.180.185.123.broad.dl.ln.dynamic.163data.com.cn.15428: NONESP-encap: isakmp: child_sa  ikev2_auth[R]
09:02:09.737621 eth0  Out IP iZt4ne8rtc7hgmeasjzdoaZ.ipsec-nat-t > 127.180.185.123.broad.dl.ln.dynamic.163data.com.cn.15428: NONESP-encap: isakmp: child_sa  ikev2_auth[R]
09:02:13.738689 eth0  In  IP 127.180.185.123.broad.dl.ln.dynamic.163data.com.cn.15428 > iZt4ne8rtc7hgmeasjzdoaZ.ipsec-nat-t: NONESP-encap: isakmp: child_sa  ikev2_auth[I]
09:02:13.738689 eth0  In  IP 127.180.185.123.broad.dl.ln.dynamic.163data.com.cn.15428 > iZt4ne8rtc7hgmeasjzdoaZ.ipsec-nat-t: NONESP-encap: isakmp: child_sa  ikev2_auth[I]
09:02:13.739280 eth0  Out IP iZt4ne8rtc7hgmeasjzdoaZ.ipsec-nat-t > 127.180.185.123.broad.dl.ln.dynamic.163data.com.cn.15428: NONESP-encap: isakmp: child_sa  ikev2_auth[R]
09:02:13.739337 eth0  Out IP iZt4ne8rtc7hgmeasjzdoaZ.ipsec-nat-t > 127.180.185.123.broad.dl.ln.dynamic.163data.com.cn.15428: NONESP-encap: isakmp: child_sa  ikev2_auth[R]
09:02:13.739346 eth0  Out IP iZt4ne8rtc7hgmeasjzdoaZ.ipsec-nat-t > 127.180.185.123.broad.dl.ln.dynamic.163data.com.cn.15428: NONESP-encap: isakmp: child_sa  ikev2_auth[R]
09:02:13.739355 eth0  Out IP iZt4ne8rtc7hgmeasjzdoaZ.ipsec-nat-t > 127.180.185.123.broad.dl.ln.dynamic.163data.com.cn.15428: NONESP-encap: isakmp: child_sa  ikev2_auth[R]
09:02:16.173773 eth0  In  IP 127.180.185.123.broad.dl.ln.dynamic.163data.com.cn.15428 > iZt4ne8rtc7hgmeasjzdoaZ.ipsec-nat-t: isakmp-nat-keep-alive

**Comment by hwdsl2** [comment]
@LazyPlanet Hello! The logs you provided are not from Libreswan, which this project uses. You may have opened the issue in the wrong project.
