### ISSUE TITLE
Fortigate client cannot accesss Internet through VPN

### ISSUE THREAD

**Issue by chienbinhso13** [hwdsl2/setup-ipsec-vpn#1364]
**Checklist**

- [x] I read the [README](https://github.com/hwdsl2/setup-ipsec-vpn/blob/master/README.md)
- [x] I read the [Important notes](https://github.com/hwdsl2/setup-ipsec-vpn/blob/master/README.md#important-notes)
  - [x] I followed instructions to [configure VPN clients](https://github.com/hwdsl2/setup-ipsec-vpn/blob/master/README.md#next-steps)
- [x] I checked [IKEv1 troubleshooting](https://github.com/hwdsl2/setup-ipsec-vpn/blob/master/docs/clients.md#ikev1-troubleshooting), [IKEv2 troubleshooting](https://github.com/hwdsl2/setup-ipsec-vpn/blob/master/docs/ikev2-howto.md#ikev2-troubleshooting) and [VPN status](https://github.com/hwdsl2/setup-ipsec-vpn/blob/master/docs/clients.md#check-logs-and-vpn-status)
- [x] I searched existing [Issues](https://github.com/hwdsl2/setup-ipsec-vpn/issues?q=is%3Aissue)
- [ ] This bug is about the VPN setup scripts, and not IPsec VPN itself

**Describe the issue**
Fortigate client cannot access Internet through VPN.

**To Reproduce**

1. Install using vpn.sh
2. Config FG with credential.
3. Add route to specific IP (ex: ifconfig.me) on FG
4. Ping to IP

**Expected behavior**
Ping should reponse Or Access to website

**Logs**
On VPN Server - Centos 7
```
[root@home]# ipsec trafficstatus
006 #2: "xauth-psk"[1] 171.234.*.*, username=vpnuser, type=ESP, add_time=1681049051, inBytes=267708, outBytes=0, maxBytes=2^63B
```
Iptables
```
-A POSTROUTING -s 10.62.100.0/24 -o eth0 -j MASQUERADE
-A POSTROUTING -s 10.62.100.0/24 -o eth0 -m policy --dir out --pol none -j MASQUERADE
-A FORWARD -d 10.62.100.0/24 -i eth0 -m conntrack --ctstate RELATED,ESTABLISHED -j ACCEPT
-A FORWARD -s 10.62.100.0/24 -o eth0 -j ACCEPT
-A FORWARD -s 10.62.100.0/24 -o ppp+ -j ACCEPT
-A FORWARD -s 10.62.100.0/24 -j ACCEPT
```

tcpdump - no response packet
```
[root@home]# tcpdump -i any -c100 -nn host 34.160.111.145
tcpdump: verbose output suppressed, use -v or -vv for full protocol decode
listening on any, link-type LINUX_SLL (Linux cooked), capture size 262144 bytes
22:52:53.970307 IP 10.62.100.1 > 34.160.111.145: ICMP echo request, id 3073, seq 0, length 64
22:52:54.986485 IP 10.62.100.1 > 34.160.111.145: ICMP echo request, id 3073, seq 1, length 64
22:52:56.006298 IP 10.62.100.1 > 34.160.111.145: ICMP echo request, id 3073, seq 2, length 64
22:52:57.026378 IP 10.62.100.1 > 34.160.111.145: ICMP echo request, id 3073, seq 3, length 64
22:52:58.046227 IP 10.62.100.1 > 34.160.111.145: ICMP echo request, id 3073, seq 4, length 64
```

CLI Fortigate 
```

# exec ping ifconfig.me
PING ifconfig.me (34.160.111.145): 56 data bytes
 
--- ifconfig.me ping statistics ---
5 packets transmitted, 0 packets received, 100% packet loss
```

**Server**
- OS: [Centos 7]
- Hosting provider: [Vultr]

**Client**
- Device: [Fortigate 50E]
- OS: [FortiOS  6.2.13]
- VPN mode: [IPsec/XAuth]

**Comment by hwdsl2** [comment]
@chienbinhso13 Hello! Fortigate as a VPN client is not currently supported in this project. With that said, based on the information you provided, it looks like you [customized VPN subnets](https://github.com/hwdsl2/setup-ipsec-vpn/blob/master/docs/advanced-usage.md#customize-vpn-subnets), but specified the same subnet for IPsec/L2TP and IPsec/XAuth. This is not recommended because it can cause issues with the IPTables rules.

You can try removing the first MASQUERADE rule on the server to see if it fixes the issue:
```
iptables -D POSTROUTING -s 10.62.100.0/24 -o eth0 -j MASQUERADE
```
If it does, remove it from your `/etc/sysconfig/iptables` so that it can persist after a reboot.

Another option is to re-install the VPN but specify different custom subnets for IPsec/L2TP and IPsec/XAuth modes.
